paper_id,author,title,year,journal,volume,issue,pages,notes
264,Villegas et al,Nitrogen-fixing sinorhizobia with Medicago laciniata constitute a novel biovar (bv. Medicaginis) of S. Meliloti,2006,Systematic and Applied Microbiology,29,,526-538,
265,Wang et al,"Rhizobium huautlense sp. Nov., a symbiont of Sesbania herbacea that has a close phylogenetic relationship with Rhizobium galegae",1998,International Journal of Systematic Bacteriology,48,,687-699,
266,Wang et al,Diversity of rhizobia associated with Amorpha fruticosa isolated from Chinese soils and description of Mesorhizobium amorphae sp. Nov. ,1999,International Journal of Systematic Bacteriology,49,,51-65,
267,Wang and Martinez-Romero,Sesbania herbacea-Rhizobium huautlense nodulation in flooded soils and comparative characterization of S. herbacea-nodulating rhizobia in different environments,2000,Microbial Ecology,41,,25-32,
268,Wang et al,Genetic diversity of rhizobia from Leucaena leucocephala nodules in Mexican soils,1999,Microbial Ecology,8,,711-724,
269,Wang et al,"Mesorhizobium albiziae sp. Nov., a novel bacterium that nodulates Albizia kalkora in a subtropical region of China",2007,International Journal of Systematic and Evolutionary Microbiology,57,,1192-1199,
270,Wang et al,Characterization of rhizobia isolated from Albizia spp. In comparison with microsymbionts of Acacia spp. And Leucaena leucocephala grown in China,2006,Systematic and Applied Microbiology,29,,502-517,
271,Wang et al,"Rhizobium elti bv. Mimosae, a novel biovar isolated from Mimosa affinis",1999,International Journal of Systematic Bacteriology,49,,1479-1491,
272,Wang et al,Diverse endophytic bacteria isolated from a leguminous tree Conzattia multiflora grown in Mexico,2006,Archives of Microbiology,186,,251-259,
273,Wang et al,"Mesorhizobium amorpha, a rhizobial species that nodulates Amorpha fruticosa, is native to American  soils",2002,Archives of Microbiology,178,,301-305,
274,Wdowiak-Wrobel and Malek,Genomic diversity of Astragalus cicer microsymbionts revealved by AFLP fingerprinting,2005,Journal of General and Applied Microbiology,51,,369-378,
275,Wei et al,A new clade of Mesohrizobium nodulating Alhagi sparsifolia,2009,Systematic and Applied Microbiology,32,,16-Aug,
276,Wei et al,"Phenotypic and genetic diversity of rhizobia isolated from nodules of the legume genera Astragalus, Lespedeza and Hedysarum in northwestern China",2008,Microbiological Research,163,,651-662,
277,Wei et al,Invasive Robinia pseudoacacia in china is nodulated by Mesorhizobium and Sinorhizobium species that share similar nodulation genes with native American symbionts,2009,FEMS Microbial Ecology,68,,320-328,
278,Wei et al,Characterization of rhizobia isolated from legume species within the genera Astragalus and Lespedeza grown in the Loess Plateau of China and description of Rhizobium loessense sp. Nov.,2003,International Journal of Systematic and Evolutionary Microbiology,53,,1575-1583,
279,Wei et al,"Rhizobium indigoferae sp. Nov. and Sinorhizobium kummerowiae sp. Nov., respectively isolated from Indigofera spp. And Kummerowia stipulacea",2002,International Journal of Systematic and Evolutionary Microbiology,52,,2231-2239,
280,Wang et al,Diverse Mesorhizobium plurifarium populations native to Mexican soils,2003,Archives of Microbiology,180,,444-454,
281,Xu et al,"Rhizobium sphaerophysae sp.nov., a novel species isolated from root nodules of Sphaerophysa salsula in China",2011,Antonie van Leeuwenhoek,99,,845-854,
282,Xu et al,"Rhizobium gilianshanense sp. Nov., a novel species isolated from root nodule of Oxytropis ochrocephala Bunge in China",2013,Antonie van Leeuwenhoek,103,,559-565,
283,Xu et al,Genetic diversity of nodulating and non-nodulating rhizobia associated with wild soybean (Glycine sojaSieb. & Zucc.) in different ecoregions of China,2011,FEMS Microbiology Ecology,76,,439-450,
284,Yang et al,Genetic diversity and symbiotic evolution of rhizobia from root nodules of Coronilla varia,2013,Systematic and Applied Microbiology,36,,49-55,
285,Yao et al,"Rhizobia taibaishanense sp. Nov., isolated from a root nodule of Kummerowia striata",2012,International Journal of Systematic and Evolutionary Microbiology,62,,335-341,
286,Zhou et al,"Mesorhizobium sangii sp. Nov., isolated from the root nodules of Astragalus luteolus and Astragalus ernestii",2013,International Journal of Systematic and Evolutionary Microbiology,63,,2794-2799,
287,Zhou et al,"Mesorhizobium robiniae sp. Nov., isolated from root nodules of Robinia pseudoacacia",2010,International Journal of Systematic and Evolutionary Microbiology,60,,2552-2556,
288,Zahran et al,Polyphasic taxonomy of symbiotic rhizobia from wild leguminous plants growing in Egypt,2003,Folia Microbiology,48,4,510-520,
289,Weir et al,"Unexpectedly diverse Mesorhizobium strains and Rhizobium leguminosarum nodulate native legume genera of New Zealand, while introduced legume weeds are nodulated by Bradyrhizobium species",2004,Applied and Environmental Microbiology,70,10,5980-5987,
290,Yates et al,Root-nodule bacteria from indigenous legumes in the north-west of Western Australia and their interaction with exotic legumes,2004,Soil Biology and Biochemistry,36,,1319-1329,
291,Xu et al,Changes in non-symbiotic nitrogen-fixing bacteria inhabiting rhizosphere soils of an invasive plant Ageratina adenophora,2012,Applied Soil Ecology,54,,32-38,
292,Zhao et al,Diverse rhizobia associated with Sophora alopecuroides grown in different regions of Loess Plateau in China,2010,Systematic and Applied Microbiology,33,,468-477,
293,Zribi et al,Medicago ciliaris growing in Tunisian soils is preferentially nodulated by Sinorhizobium medicae,2007,Australian Journal of Soil Research,42,,473-477,
294,Zribi et al,Distribution and genetic diversity of rhizobia nodulating natural populations of Medicago truncatula in tunisian soils,2004,Soil Biology and Biochemistry,36,,903-908,
295,Willems et al,AFLP fingerprint analysis of Bradyrhizobium strains isolated from Faidherbia albida and Aeschynomene species,2000,Systematic and Applied Microbiology,23,,137-147,
296,Zhao et al,Diverse genomic species and evidences of symbiotic gene lateral transfer detected among the rhizobia associated with Astragalus species grown in the temperate regions of China,2008,FEMS microbiology Letters,286,,263-273,
297,Yan et al,Mesorhizobium spp. Are the main microsymbionts of Caragana spp. Grown in Liaoning province of China,2007,FEMS microbiology Letters,271,,265-273,
298,Yao et al,Characterization of rhizobia that nodulate legume species of the genus Lespedeza and description of Bradyrhizobium yuanmingense sp. Nov.,2002,International Journal of Systematic and Evolutionary Microbiology,52,,2219-2230,
299,Zurdo-Pineiro,Identification of fast-growing rhizobia nodulating tropical legumes from Puerto Rico as Rhizobium gallicum and Rhizobium tropici,2004,Systematic and Applied Microbiology,27,,469-477,
300,Zakhia et al,Characterisation of Wild Legume Nodulating Bacteria in the Infra-arid zone of Tunisia,2004,Systematic and Applied Microbiology,27,,380-395,
301,Zakhia et al,Diverse bacteria associated with root nodules of spontaneous legumes in Tunisia and first report for nifH-like gene within the genera Microbacterium and Starkeya,2006,Microbial Ecology,51,,375-393,
302,Banasiewics et al,Diversity and phylogenetic affinities of Bradyrhizobium isolates from Pampa and Atlantic Forest Biomes,2021,Systematic and Applied Microbiology,44,,126203,
303,Steencamp et al,Burkholderia kirstenboschensis sp. nov. nodulates papilionoid legumesindigenous to South Africa,2015,Systematic and Applied Microbiology,38,,545-554,
304,Eardly et al,"Biogeography of a Novel Ensifer meliloti
Clade Associated with the Australian
Legume Trigonella suavissima",2017,Applied and Environmental Microbiology,83,10,e03446-16,
305,Liu et al,Burkholderia sp. Induces functional nodules on the south african invasive legume Dipogon lignosus (Phaseoleae) in New Zealand Soils,2014,Microbial Ecology ,68,,542-555,
322,Chouhan et al,"Evolution of novel strains of Ensifer nodulating the
invasive legume Leucaena leucocephala (Lam.) de Wit
in different climatic regions of India through lateral
gene transfer",2022,FEMS Microbial Ecology,98,,19-Jan,"this might be considered an agricultural species - used for fuel, fiber, wood, and food; 222 strains cultured, but only 114 genetically fingerprinted"
323,Harrison et al,Geographically structured genetic variation in the Medicago lupulina–Ensifer mutualism,2017,Evolution,71,7,1787-1801,
324,Hsouna et al,"Genotypic and symbiotic diversity studies of rhizobia nodulating Acacia
saligna in Tunisia reveal two novel symbiovars within the Rhizobium
leguminosarum complex and Bradyrhizobium",2022,Systematic and Applied Microbiology,45,,126343,
325,Huang,Phylogenetic analyses of Bradyrhizobium symbionts associated withinvasive Crotalaria zanzibarica and its coexisting legumes in Taiwan,2018,Systematic and Applied Microbiology,41,,619-628,
326,Le Roux et al,"The structure of legume–rhizobium interaction networks
and their response to tree invasions",2016,AoB Plants,8,,plw038,
327,Li et al,Genetic diversity and community structure of rhizobia nodulatingSesbania cannabina in saline–alkaline soils,2016,Systematic and Applied Microbiology,39,,195-202,
328,Liu et al,"New Insight into the Evolution of Symbiotic Genes in Black
Locust-Associated Rhizobia",2019,Genome Biology and Evolution,11,7,1736-1750,
329,Lui et al,"Diversity and Geographic
Distribution of Microsymbionts
Associated With Invasive Mimosa
Species in Southern China",2020,Frontiers in Microbiology,11,,563389,
330,Wendlandt et al,"Decreased coevolutionary potential and
increased symbiont fecundity during the
biological invasion of a legume-rhizobium
mutualism",2021,Evolution,75,3,731-747,
321,Cheng et al,Diversity analysis of the rhizospheric and endophytic bacterial communities of Senecio vulgaris L. (Asteraceae) in an invasive range,2019,PeerJ,6,,e6162,
320,Chen et al,Wild peanut Arachis duranensis are nodulated by diverse and novel Bradyrhizobium species in acid soils,2014,Systematic and Applied Microbiology,37,,525-532,
319,Bromfield et al,"Description and complete genome sequences of Bradyrhizobium symbiodeficiens sp. nov., a non-symbiotic bacterium associated with legumes native to Canada",2020,International Journal of Systematic and Evolutionary Microbiology,70,,442-449,
318,Bromfield et al,Invasive Galega officinalis (Goat's rue) plants in Canada form a symbiotic association with strains of Neorhizobium galegae sv. officinalis originating from the Old World,2019,Ecology and Evolution,9,,6999-7004,
317,Birnham et al.,Effect of plant root symbionts on performance of native woody species in competition with an invasive grass in multispecies microcosms,2017,Ecology and Evolution,8,,8652-8664,This paper seems irrelevant
316,Beukes et al ,Both Alpha- and Beta-Rhizobia Occupy the Root Nodules of Vachellia karroo in South Africa ,2019,Frontiers in Microbiology,10,,1195,
315,Banasiewicz et al,Diversity and phylogenetic affinities of Bradyrhizobium isolates from Pampa and Atlantic Forest Biomes,2021,Systematic and Applied Microbiology,44,,126203,
307,Boakye et al,Characterization and diversity of rhizobia nodulating selected tree legumes in Ghana,2016,Symbiosis,69,,89-99,
308,Huang et al,"Phylogenetic Identification, Phenotypic Variations, and Symbiotic Characteristics of the Peculiar Rhizobium, Strain CzR2, Isolated from Crotalaria zanzibarica in Taiwan",2016,Microbes and Environment,31,4,410-417,
309,Keet et al,Legume–rhizobium symbiotic promiscuity and effectiveness do not affect plant invasiveness,2017,Annas of Botany,119,,1319-1331,
310,Melkonian et al,The geographical patterns of symbiont diversity in the invasive legume Mimosa pudica can be explained by the competitiveness of its symbionts and by the host genotype,2014,Environmental Microbiology,16,7,2099-2111,
311,Porter et al,Co-invading symbiotic mutualists of Medicago polymorpha retain high ancestral diversity and contain diverse accessory genomes,2017,FEMS Mircrobiology Ecology,94,,fix168,
312,Simonsen et al,Symbiosis limits establishment of legumes outside their native range at a global scale,2017,Nature communications,8,,14790,This is a review and I think we are not including reviews?
313,,,,,,,,"I only had six papers selected before, so I don't have 313"
306,La Pierre et al,"Invasive legumes can associate with many mutualists of native legumes, but usually do not",2017,Ecology and Evolution,7,20,8599-8611,
314,Willems et al,"Genome sequence of Burkholderia mimosarum strain LMG 23256T , a Mimosa pigra microsymbiont from Anso, Taiwan",2014,Standards in Genomic Sciences,9,,484-494,This paper seems a little out of context-check again